{
  "schema_version": 1,
  "reference_id": "ridgecrest-usgs-mainshocks-smoke",
  "version": "1",
  "role": "operational-mainshock-smoke",
  "path": "catalog.json",
  "description": "Two-event smoke reference for pipeline verification; not a complete Ridgecrest reference catalog.",
  "source_identity": "USGS_SCSN_COMCAT_2019__catalog_operational_full.csv rows ci38443183 and ci38457511"
}
